{
  "schema": 2,
  "skeptic_version": "v0.1.2-0.20260926180449-c31537a4a23f+dirty",
  "generated_at": "2026-09-26T18:09:44.506079956Z",
  "host": {
    "os": "linux",
    "arch": "amd64",
    "docker_api": "1.54"
  },
  "run_dir": ".skeptic/runs/20260926-180821",
  "totals": {
    "total": 3,
    "clean": 3,
    "flagged": 0,
    "errors": 0,
    "no_oracle": 0,
    "unsupported": 0,
    "weak_tests": 0
  },
  "tasks": [
    {
      "id": "scikit-learn__scikit-learn-14141",
      "format": "swebench",
      "dir": "/home/user/skeptic/results/swe-bench-verified/2026-09-25-controls/subset-instances.jsonl",
      "verdict": "CLEAN",
      "reason": "oracle 1.00, nop 0.00",
      "nop_score": 0,
      "oracle_score": 1,
      "nop_seconds": 5.9170261889999995,
      "oracle_seconds": 5.622838558,
      "seconds": 83.141492711,
      "image_digest": "sha256:c0f6a733154dad51cb8f617ca2ea09d095a6f56a1576740c2d43f9020294f2e0",
      "log_dir": ".skeptic/runs/20260926-180821/scikit-learn__scikit-learn-14141"
    },
    {
      "id": "sphinx-doc__sphinx-8621",
      "format": "swebench",
      "dir": "/home/user/skeptic/results/swe-bench-verified/2026-09-25-controls/subset-instances.jsonl",
      "verdict": "CLEAN",
      "reason": "oracle 1.00, nop 0.00",
      "nop_score": 0,
      "oracle_score": 1,
      "nop_seconds": 9.07650181,
      "oracle_seconds": 7.487710558,
      "seconds": 72.06361465,
      "image_digest": "sha256:6920990997f285a23170dfb17f61f14f80ce31f608b9f061d1bdc3a32aec983a",
      "log_dir": ".skeptic/runs/20260926-180821/sphinx-doc__sphinx-8621"
    },
    {
      "id": "sympy__sympy-22914",
      "format": "swebench",
      "dir": "/home/user/skeptic/results/swe-bench-verified/2026-09-25-controls/subset-instances.jsonl",
      "verdict": "CLEAN",
      "reason": "oracle 1.00, nop 0.00",
      "nop_score": 0,
      "oracle_score": 1,
      "nop_seconds": 9.003640485,
      "oracle_seconds": 5.859501714,
      "seconds": 66.562029013,
      "image_digest": "sha256:aa5f1cf12ce166511d03eed6ac0de0f76b27777ac2c6ddb4a9b11f67f000941f",
      "log_dir": ".skeptic/runs/20260926-180821/sympy__sympy-22914"
    }
  ]
}
