{
  "schema": 2,
  "skeptic_version": "v0.1.2-0.20260926180449-c31537a4a23f+dirty",
  "generated_at": "2026-09-26T18:08:15.820292404Z",
  "host": {
    "os": "linux",
    "arch": "amd64",
    "docker_api": "1.54"
  },
  "run_dir": ".skeptic/runs/20260926-180548",
  "totals": {
    "total": 3,
    "clean": 3,
    "flagged": 0,
    "errors": 0,
    "no_oracle": 0,
    "unsupported": 0,
    "weak_tests": 0
  },
  "tasks": [
    {
      "id": "django__django-16082",
      "format": "swebench",
      "dir": "/home/user/skeptic/results/swe-bench-verified/2026-09-25-controls/subset-instances.jsonl",
      "verdict": "CLEAN",
      "reason": "oracle 1.00, nop 0.00",
      "nop_score": 0,
      "oracle_score": 1,
      "nop_seconds": 13.117122129,
      "oracle_seconds": 13.733311313,
      "seconds": 108.393259013,
      "image_digest": "sha256:a553a5c186a49df0a5c6b97499e2318e4db2d8f6992059fe144758e850670572",
      "log_dir": ".skeptic/runs/20260926-180548/django__django-16082"
    },
    {
      "id": "pydata__xarray-3677",
      "format": "swebench",
      "dir": "/home/user/skeptic/results/swe-bench-verified/2026-09-25-controls/subset-instances.jsonl",
      "verdict": "CLEAN",
      "reason": "oracle 1.00, nop 0.00",
      "nop_score": 0,
      "oracle_score": 1,
      "nop_seconds": 10.830607561,
      "oracle_seconds": 9.776664146,
      "seconds": 144.902038944,
      "image_digest": "sha256:4a68ac272a07b3b4762756ae9d24b5de1cce82aae696b6dc3deb9676a4b0c14e",
      "log_dir": ".skeptic/runs/20260926-180548/pydata__xarray-3677"
    },
    {
      "id": "pylint-dev__pylint-7080",
      "format": "swebench",
      "dir": "/home/user/skeptic/results/swe-bench-verified/2026-09-25-controls/subset-instances.jsonl",
      "verdict": "CLEAN",
      "reason": "oracle 1.00, nop 0.00",
      "nop_score": 0,
      "oracle_score": 1,
      "nop_seconds": 39.552893655,
      "oracle_seconds": 32.834704296,
      "seconds": 147.292331799,
      "image_digest": "sha256:3389f0d1319ca611d04a209fc30990c131e0bae9acfeb2163938c75ad23479fe",
      "log_dir": ".skeptic/runs/20260926-180548/pylint-dev__pylint-7080"
    }
  ]
}
