{
  "schema": 2,
  "skeptic_version": "v0.1.2-0.20260926180449-c31537a4a23f+dirty",
  "generated_at": "2026-09-26T18:16:44.465449615Z",
  "host": {
    "os": "linux",
    "arch": "amd64",
    "docker_api": "1.54"
  },
  "run_dir": ".skeptic/runs/20260926-180947",
  "totals": {
    "total": 3,
    "clean": 3,
    "flagged": 0,
    "errors": 0,
    "no_oracle": 0,
    "unsupported": 0,
    "weak_tests": 0
  },
  "tasks": [
    {
      "id": "matplotlib__matplotlib-23314",
      "format": "swebench",
      "dir": "/home/user/skeptic/results/swe-bench-verified/2026-09-25-controls/subset-instances.jsonl",
      "verdict": "CLEAN",
      "reason": "oracle 1.00, nop 0.00",
      "nop_score": 0,
      "oracle_score": 1,
      "nop_seconds": 145.670247899,
      "oracle_seconds": 142.753440977,
      "seconds": 415.338108516,
      "image_digest": "sha256:f88a00b6cfc878eb62965e836134dd9425b0188bfa2b8154d439bda001ed604c",
      "log_dir": ".skeptic/runs/20260926-180947/matplotlib__matplotlib-23314"
    },
    {
      "id": "mwaskom__seaborn-3187",
      "format": "swebench",
      "dir": "/home/user/skeptic/results/swe-bench-verified/2026-09-25-controls/subset-instances.jsonl",
      "verdict": "CLEAN",
      "reason": "oracle 1.00, nop 0.00",
      "nop_score": 0,
      "oracle_score": 1,
      "nop_seconds": 85.952346757,
      "oracle_seconds": 88.376418669,
      "seconds": 417.053262082,
      "image_digest": "sha256:aea7e43b20703256f5cb807b54cd78a12601f21086d3a62a41de18c254771f4e",
      "log_dir": ".skeptic/runs/20260926-180947/mwaskom__seaborn-3187"
    },
    {
      "id": "pallets__flask-5014",
      "format": "swebench",
      "dir": "/home/user/skeptic/results/swe-bench-verified/2026-09-25-controls/subset-instances.jsonl",
      "verdict": "CLEAN",
      "reason": "oracle 1.00, nop 0.00",
      "nop_score": 0,
      "oracle_score": 1,
      "nop_seconds": 13.078940398,
      "oracle_seconds": 11.428128792,
      "seconds": 87.853155622,
      "image_digest": "sha256:bde4fbdafa36141d4396944da88ec37aabdef612ed36920090675bccd0ca5d72",
      "log_dir": ".skeptic/runs/20260926-180947/pallets__flask-5014"
    }
  ]
}
